[
  {
    "product_id": "olipop_vintage_cola",
    "source": "reddit",
    "timestamp": "2025-06-21T13:00:00Z",
    "feedback_text": "Tastes just like classic cola but healthier!",
    "sentiment_label": "positive",
    "authenticity_score": 0.92,
    "summary_text": "Healthier alternative to regular cola with great taste.",
    "metadata": {
      "username_hash": "sha256:def456",
      "verified_purchase": true,
      "upvotes": 15,
      "permalink": "https://reddit.com/r/food/comments/abc"
    },
    "tags": [
      "food",
      "soda",
      "healthy"
    ]
  },
  {
    "product_id": "kirkland_almond_butter",
    "source": "amazon",
    "timestamp": "2025-06-21T14:10:00Z",
    "feedback_text": "Creamy and affordable, great for smoothies.",
    "sentiment_label": "positive",
    "authenticity_score": 0.88,
    "summary_text": "Affordable, creamy almond butter ideal for smoothies.",
    "metadata": {
      "username_hash": "sha256:ghi789",
      "verified_purchase": true,
      "upvotes": 8,
      "permalink": "https://amazon.com/review/123"
    },
    "tags": [
      "food",
      "nut_butter",
      "breakfast"
    ]
  },
  {
    "product_id": "swiffer_wetjet",
    "source": "youtube",
    "timestamp": "2025-06-21T15:20:00Z",
    "feedback_text": "Makes cleaning floors so much easier!",
    "sentiment_label": "positive",
    "authenticity_score": 0.95,
    "summary_text": "Efficient and easy-to-use floor cleaning tool.",
    "metadata": {
      "username_hash": "sha256:jkl012",
      "verified_purchase": false,
      "upvotes": 22,
      "permalink": "https://youtube.com/watch?v=swifferreview"
    },
    "tags": [
      "household",
      "cleaning",
      "floors"
    ]
  },
  {
    "product_id": "bounty_paper_towels",
    "source": "yelp",
    "timestamp": "2025-06-21T16:05:00Z",
    "feedback_text": "Absorbs spills quickly, lasts longer than other brands.",
    "sentiment_label": "positive",
    "authenticity_score": 0.81,
    "summary_text": "Durable and highly absorbent paper towels.",
    "metadata": {
      "username_hash": "sha256:mno345",
      "verified_purchase": true,
      "upvotes": 5,
      "permalink": "https://yelp.com/review/456"
    },
    "tags": [
      "household",
      "paper_towels",
      "kitchen"
    ]
  },
  {
    "product_id": "cerave_foaming_cleanser",
    "source": "reddit",
    "timestamp": "2025-06-21T12:30:00Z",
    "feedback_text": "Great for my oily skin!",
    "sentiment_label": "positive",
    "authenticity_score": 0.86,
    "summary_text": "Improved oily skin with regular use.",
    "metadata": {
      "username_hash": "sha256:abc123",
      "verified_purchase": true,
      "upvotes": 30,
      "permalink": "https://reddit.com/r/skincare/comments/xyz"
    },
    "tags": [
      "skincare",
      "facewash",
      "acne"
    ]
  }
]